{
  "schema_version": "ael.evidence-receipt/0.1",
  "object_type": "evidence_receipt",
  "receipt_id": "kizz:ael:receipt:focused-change-verification-calibration-v1",
  "generated_at": "2026-08-11T22:55:00Z",
  "concept_ref": {
    "concept_id": "kizz:ael:example:focused-change-verification-skill",
    "revision": 1,
    "uri": "../concept.json",
    "sha256": "056da8f4a9bd5f90140f3440e7c283b0c172f64adfa5606f783a8223372d48b8",
    "visibility": "public"
  },
  "study_ref": {
    "study_id": "kizz:ael:study:focused-change-verification-skill",
    "revision": 1,
    "uri": "../study-manifest.json",
    "sha256": "330700bc8cb12d77520f251fb94f54c8b879a9915c39f530feaf5d56a1bed841",
    "visibility": "public"
  },
  "run_record_refs": [
    {
      "run_id": "kizz:ael:run:focused-change-verification-calibration:local-unit-S0-01",
      "uri": "runs/local-unit-S0-01.json",
      "sha256": "2d1af1c992511cc015d2d3624b617cfc20545659748eb2d4e19218408404638a",
      "visibility": "public"
    },
    {
      "run_id": "kizz:ael:run:focused-change-verification-calibration:local-unit-S1-01",
      "uri": "runs/local-unit-S1-01.json",
      "sha256": "8adc6c3a3cd041255d91e75efedcfa412cde4f781f4ddc62b369f2fd1644d1fc",
      "visibility": "public"
    },
    {
      "run_id": "kizz:ael:run:focused-change-verification-calibration:cross-contract-S0-01",
      "uri": "runs/cross-contract-S0-01.json",
      "sha256": "d68662c9e3fc296b91d20cc826aeeaf44d22b5e1e38778e67ebf9cab6e50f929",
      "visibility": "public"
    },
    {
      "run_id": "kizz:ael:run:focused-change-verification-calibration:cross-contract-S1-01",
      "uri": "runs/cross-contract-S1-01.json",
      "sha256": "6abeea0eb521ba1bf8548c9329d56dd651e4369d4ccdd10279062055f3579828",
      "visibility": "public"
    },
    {
      "run_id": "kizz:ael:run:focused-change-verification-calibration:migration-S0-01",
      "uri": "runs/migration-S0-01.json",
      "sha256": "195d089f6a892add9f6197d60fb197d88325e8b234ae83b62b99849a113094a0",
      "visibility": "public"
    },
    {
      "run_id": "kizz:ael:run:focused-change-verification-calibration:migration-S1-01",
      "uri": "runs/migration-S1-01.json",
      "sha256": "47dd47a0a3d908cfd1e30d3fd75cd5b459e4ca7e1e6f6f8a698a52187b3a78d6",
      "visibility": "public"
    }
  ],
  "measurement_set_ref": {
    "measurement_set_id": "kizz:ael:measurements:focused-change-verification-calibration-v1",
    "uri": "measurement-set.json",
    "sha256": "5172087b3082098af68655e23b496d9f53f2f43406ff3c7bd2503ec453e30978",
    "visibility": "public"
  },
  "evidence_level": "runtime_conformant",
  "reproducibility": "rerunnable",
  "independence": {
    "label": "maintainer_evaluated",
    "role_overlaps": [
      "Kizz owns the intervention, task pack, runner, evaluator, analysis, and continuation decision."
    ],
    "disclosure": "This is maintainer calibration evidence, not independent certification or a confirmatory skill-effect study."
  },
  "decision": {
    "disposition": "narrow",
    "summary": "Keep the Codex runner and current pack as an operational smoke surface, but do not spend the planned 18-cell budget on this ceiling-limited pack; design tasks that do not restate the skill before estimating an effect.",
    "scope": [
      "Codex CLI 0.146.0 with gpt-5.6-sol at xhigh effort",
      "the exact pinned runtime and proxy image IDs in the six run records",
      "three public maintainer-authored calibration tasks",
      "one non-randomized repeat per condition and task"
    ],
    "reversal_trigger": "Reconsider after a frozen discriminating pack, preregistered behavioral rubric, randomized order, repeated cells, and a safer credential boundary are available."
  },
  "evaluated_claims": [
    {
      "claim_id": "AEL-FCV-CAL-01",
      "statement": "The controlled-egress Docker adapter executed six stable Codex cells without changing any canonical fixture and captured enough telemetry for deterministic post-run evaluation.",
      "status": "supported",
      "claim_level": "workflow",
      "scope": [
        "six runtime-v2 calibration cells",
        "maintainer-controlled fixtures"
      ],
      "evidence_refs": [
        "canonical-fixture-mutation",
        "acceptance-total:S0",
        "acceptance-total:S1"
      ],
      "falsifier": "A byte-equivalent rerun mutates a fixture, cannot export a candidate, or cannot bind telemetry to the evaluated workspace."
    },
    {
      "claim_id": "AEL-FCV-CAL-02",
      "statement": "The frozen skill was installed and explicitly read in all three treatment cells and in no baseline cell.",
      "status": "supported",
      "claim_level": "artifact",
      "scope": [
        "S1 treatment cells",
        "retained private Codex event streams"
      ],
      "evidence_refs": [
        "skill-activation:local-unit:S1",
        "skill-activation:cross-contract:S1",
        "skill-activation:migration:S1"
      ],
      "falsifier": "A retained treatment trace lacks the exact skill read or a baseline trace loads it."
    },
    {
      "claim_id": "AEL-FCV-CAL-03",
      "statement": "No deterministic implementation-acceptance difference was observed: baseline and treatment each passed three of three tasks.",
      "status": "bounded",
      "claim_level": "workflow",
      "scope": [
        "one calibration repeat",
        "three public tasks",
        "deterministic acceptance only"
      ],
      "evidence_refs": [
        "acceptance-total:S0",
        "acceptance-total:S1"
      ],
      "falsifier": "Repeated matched runs on a discriminating pack produce a stable acceptance or critical-omission difference."
    },
    {
      "claim_id": "AEL-FCV-CAL-04",
      "statement": "The current public prompts are too explicit to isolate the skill's verification-routing contribution and should remain smoke tests rather than become the first confirmatory pack.",
      "status": "bounded",
      "claim_level": "workflow",
      "scope": [
        "current task wording",
        "observed 6-of-6 acceptance ceiling"
      ],
      "evidence_refs": [
        "acceptance-total:S0",
        "acceptance-total:S1"
      ],
      "falsifier": "A preregistered repeated study on the unchanged pack exhibits reliable non-ceiling discrimination on the primary behavioral estimand."
    },
    {
      "claim_id": "AEL-FCV-CAL-05",
      "statement": "Treatment finals more consistently separated local validation from commit, push, deployment, and outcome state, but this observation was not scored by a preregistered rubric.",
      "status": "unresolved",
      "claim_level": "workflow",
      "scope": [
        "six final responses",
        "post-hoc qualitative observation"
      ],
      "evidence_refs": [
        "generated-work-total:S0",
        "generated-work-total:S1"
      ],
      "falsifier": "A blinded preregistered state-reporting rubric finds no stable paired difference or favors baseline."
    }
  ],
  "unsupported_inferences": [
    "The skill improves implementation correctness or code quality.",
    "The skill is cost-effective or faster.",
    "The skill transfers to real repositories or other models and agent runtimes.",
    "Codex or gpt-5.6-sol is superior to Claude Code, Cursor, another CLI, or another model.",
    "The current credential boundary is safe for untrusted third-party tasks or skills.",
    "Three acceptance passes per condition establish equivalence."
  ],
  "limitations": [
    "One non-randomized calibration repeat was run per task and condition; this is not an effect estimate.",
    "The public task prompts explicitly request much of the verification behavior contributed by the skill, creating a ceiling and treatment-contamination risk.",
    "Kizz owns the skill, tasks, runner, deterministic evaluator, and decision.",
    "The provider exposes a model identifier but not an immutable model revision.",
    "Generated-work and wall-time budgets were matched by configuration but not forced to equal realized usage.",
    "The reusable ChatGPT credential was process-readable; persisted outputs were scanned, but encrypted provider traffic was not inspected.",
    "No downstream rework, production behavior, user outcome, or third-party replication was measured."
  ],
  "invalidation_triggers": [
    "A change to the frozen skill, task pack, prompt, Codex version, model/effort, runner image, proxy policy, or evaluator",
    "New evidence that credential content entered persisted artifacts or unauthorized traffic",
    "A repeated or real-shadow study contradicting the calibration observations",
    "A public claim that omits the maintainer-evaluated and calibration-only scope"
  ],
  "state": {
    "experiment": "six-cell runner calibration completed; planned 18-cell adaptation study not run",
    "artifact": "frozen skill and public task pack locally validated",
    "repository": "included in the v0.1.0-alpha.1 release candidate",
    "publication": "prepared for public alpha release",
    "deployment": "not deployed",
    "outcome": "not observed"
  },
  "publication_state": "public_ready",
  "generator": {
    "name": "agentic-evidence-lab",
    "version": "0.1.0a1"
  }
}
